Skin Concern,Preferred Ingredients,Excluded Ingredients
Sensitive,"Aloe Vera, Argan Oil, Borage Oil, Calendula, Chamomile, Evening Primrose, Jojoba, Hyaluronic Acid, Olive Oil, Prickly Pear, Sea Buckthorn, Seaweed, Shea Butter, Sunflower Seed Oil, Witch Hazel, Green Tea, Oatmeal, Bisabolol, Allantoin, Ceramides, Lecithin, Honey","Synthetic Fragrance, Essential Oils, Methylisothiazolinone, Methylchloroisothiazolinone, Diazolidinyl Urea, Exfoliating Abrasives, Exfoliating Acids, Salicylic Acid, Benzoyl Peroxide, Lanolin, Sulfates, Retinoids, Denatured Alcohol, Oxybenzone, Parabens, Formaldehyde, Talc, Phthalates, Heavy Metals, Chemical Sunscreens, Fragrance (Parfum)"
Acne,"Salicylic Acid, Benzoyl Peroxide, Hyaluronic Acid, Niacinamide, Vitamin B, Retinol, Retin A, Glycolic Acid, Lactic Acid, Zinc, Tea Tree Oil, Centella Asiatica, Vitamin C, Adapalene, Sulfur, Ceramides, Green Tea, Mandelic Acid, Clay","Cocoa Butter, Lanolin, Mineral Oil, Paraffin, Petroleum Jelly, Silicones, Alcohol, Fragrance, Essential Oils, Comedogenic Oil, Shea Butter, Isopropyl Myristate, Algae Extract, Octocrylene, Octinoxate, Artificial Dyes, Propylene Glycol, Butyl Stearate, Palmitic Acid, Neem Oil, Coconut Oil, Olive Oil, Parabens, Vitamin E"
Oily,"Salicylic Acid, Niacinamide, Vitamin B3, Honey, Clay, Antioxidants, Vitamin C, Vitamin E, Matte-Finish Sunscreen, Green Tea, Aloe Vera, Witch Hazel, Cucumber Extract, Lactic Acid","Coconut Oil, Cocoa Butter, Mineral Oil, Silicones, Fragrance, Fatty Acids, Hyaluronic Acid, Isopropyl Myristate, Capric Triglyceride, Shea Butter, Glycerin, Retinol, Beeswax, Lanolin, Tea Tree Oil, Witch Hazel, Cinnamon, Menthol, Denatured Alcohol, Mango Butter, Squalane, Stearic Acid, Soybean Oil, Hydroquinone, "
Dry,"Hyaluronic acid, Glycerin, Ceramides, Shea Butter, Lactic Acid, Coconut Oil, Glycolic acid, Panthenol, Lanolin, Jojoba oil, Vitamin E, Squalene, Sodium Hyaluronate, Cocoa Butter, Olive Oil, Argan Oil, Avocado Oil, Almond Oil, Rose Water, Flaxseed Oil, Hempseed Oil, Aloe Vera, Panthenol, Niacinamide, Colloidal Oatmeal, Primrose Oil","Alcohol, Fragrance, Salicylic Acid, Benzoyl Peroxide, Retinol, Alpha-hydroxy acid, Retinoids, Vitamin C, Essential Oil, Witch Hazel, Menthol, Eucalyptus, Clay, Artificial Dyes, Petrolatum, Mineral Oil, Isopropyl Alcohol, Benzalkonium Chloride, Mint, Camphor, Baking Soda, Parabens"
Combination,"Hyaluronic acid, Ceramides, Lactic Acid, Antioxidants, Niacinamide, Peptide, Retinol, Glycolic Acid, Jojoba Oil, Glycerin, Squalane, Green Tea, Vitamin C, Aloe Vera, Argan Oil, Sodium Hyaluronate, Centella Asiatica, Polyhydroxy Acids, Vitamin E, Chamomile Extract, Caffeine, Soy Extract, Amino Acids, Marula Oil, Cucumber Extract, Peptides, Primrose Oil, Mandelic Acid","Alcohol, Fragrance, Essential Oils, Benzoyl Peroxide, Salicylic acid, Clay, Artificial Dyes, Petrolatum, Mineral Oil, Isopropyl Alcohol, Benzalkonium Chloride, Parabens, Phenoxyethanol, Witch Hazel, Camphor, Baking Soda, Tea Tree Oil"